{"schema_version":1,"contains_flags":{"pork":{"label":{"en":"pork","de":"Schwein"}},"beef":{"label":{"en":"beef","de":"Rind"}},"lamb":{"label":{"en":"lamb","de":"Lamm"}},"poultry":{"label":{"en":"poultry","de":"Geflügel"}},"fish":{"label":{"en":"fish","de":"Fisch"}},"shellfish":{"label":{"en":"shellfish","de":"Schalentiere"}},"molluscs":{"label":{"en":"molluscs","de":"Weichtiere"}},"egg":{"label":{"en":"egg","de":"Ei"}},"dairy":{"label":{"en":"dairy","de":"Milch"}},"gluten":{"label":{"en":"gluten","de":"Gluten"}},"soy":{"label":{"en":"soy","de":"Soja"}},"peanuts":{"label":{"en":"peanuts","de":"Erdnüsse"}},"tree-nuts":{"label":{"en":"tree nuts","de":"Baumnüsse"}},"almonds":{"label":{"en":"almonds","de":"Mandeln"}},"walnuts":{"label":{"en":"walnuts","de":"Walnüsse"}},"pistachios":{"label":{"en":"pistachios","de":"Pistazien"}},"cashews":{"label":{"en":"cashews","de":"Cashews"}},"sesame":{"label":{"en":"sesame","de":"Sesam"}},"mustard":{"label":{"en":"mustard","de":"Senf"}},"celery":{"label":{"en":"celery","de":"Sellerie"}},"lupin":{"label":{"en":"lupin","de":"Lupinen"}},"sulphites":{"label":{"en":"sulphites","de":"Sulfite"}},"alcohol":{"label":{"en":"alcohol","de":"Alkohol"}},"caffeine":{"label":{"en":"caffeine","de":"Koffein"}},"added-sugar":{"label":{"en":"added sugar","de":"zugesetzter Zucker"}},"high-fodmap":{"label":{"en":"high FODMAP","de":"FODMAP-reich"}},"gelatin-non-halal":{"label":{"en":"non-halal gelatin","de":"nicht-halale Gelatine"}},"gelatin-non-kosher":{"label":{"en":"non-kosher gelatin","de":"nicht-koschere Gelatine"}},"honey":{"label":{"en":"honey","de":"Honig"}}},"compound_flags":{"vegan":{"label":{"en":"vegan","de":"vegan"},"expands_to":["pork","beef","lamb","poultry","fish","shellfish","molluscs","egg","dairy","honey","gelatin-non-halal","gelatin-non-kosher"]},"vegetarian":{"label":{"en":"vegetarian","de":"vegetarisch"},"expands_to":["pork","beef","lamb","poultry","fish","shellfish","gelatin-non-halal","gelatin-non-kosher"]},"pescatarian":{"label":{"en":"pescatarian","de":"pescetarisch"},"expands_to":["pork","beef","lamb","poultry","gelatin-non-halal"]},"halal":{"label":{"en":"halal","de":"halal"},"expands_to":["pork","alcohol","gelatin-non-halal"]},"kosher":{"label":{"en":"kosher","de":"koscher"},"expands_to":["pork","shellfish","gelatin-non-kosher"]},"low-fodmap":{"label":{"en":"low FODMAP","de":"FODMAP-arm"},"expands_to":["high-fodmap"]},"sugar-free":{"label":{"en":"sugar-free","de":"zuckerfrei"},"expands_to":["added-sugar"]},"lactose-free":{"label":{"en":"lactose-free","de":"laktosefrei"},"expands_to":["dairy"]},"nut-free":{"label":{"en":"nut-free","de":"nussfrei"},"expands_to":["peanuts","tree-nuts","almonds","walnuts","pistachios","cashews"]}},"attributes":{"halal":{"label":{"en":"halal","de":"halal"}},"kosher":{"label":{"en":"kosher","de":"koscher"}},"vegan":{"label":{"en":"vegan","de":"vegan"}},"vegetarian":{"label":{"en":"vegetarian","de":"vegetarisch"}},"gluten-free":{"label":{"en":"gluten-free","de":"glutenfrei"}},"high-protein":{"label":{"en":"high protein","de":"proteinreich"}},"low-carb":{"label":{"en":"low carb","de":"kohlenhydratarm"}},"comfort":{"label":{"en":"comfort","de":"Komfort"}},"weeknight":{"label":{"en":"weeknight","de":"alltagstauglich"}},"one-pan":{"label":{"en":"one pan","de":"ein Topf"}},"meal-prep":{"label":{"en":"meal prep","de":"meal prep"}},"kid-friendly":{"label":{"en":"kid-friendly","de":"kinderfreundlich"}},"alcohol-free":{"label":{"en":"alcohol-free","de":"alkoholfrei"}},"caffeine-free":{"label":{"en":"caffeine-free","de":"koffeinfrei"}}},"effort":{"values":["easy","medium","hard"],"labels":{"easy":{"en":"easy","de":"einfach"},"medium":{"en":"medium","de":"mittel"},"hard":{"en":"hard","de":"anspruchsvoll"}}},"time_bucket":{"labels":{"t15":{"en":"≤ 15 min","de":"≤ 15 Min"},"t30":{"en":"≤ 30 min","de":"≤ 30 Min"},"t60":{"en":"≤ 60 min","de":"≤ 60 Min"},"t60plus":{"en":"> 60 min","de":"> 60 Min"}}},"calorie_bucket":{"labels":{"c400":{"en":"≤ 400 kcal","de":"≤ 400 kcal"},"c600":{"en":"≤ 600 kcal","de":"≤ 600 kcal"},"c800":{"en":"≤ 800 kcal","de":"≤ 800 kcal"},"c800plus":{"en":"> 800 kcal","de":"> 800 kcal"}}},"techniques":{"values":["bake","saute","simmer","raw","grill","fry","steam","roast","broil","pan-fry","deep-fry","stir-fry","poach","blanch"],"labels":{"bake":{"en":"bake","de":"backen"},"saute":{"en":"sauté","de":"anbraten"},"simmer":{"en":"simmer","de":"köcheln"},"raw":{"en":"raw","de":"roh"},"grill":{"en":"grill","de":"grillen"},"fry":{"en":"fry","de":"braten"},"steam":{"en":"steam","de":"dämpfen"},"roast":{"en":"roast","de":"rösten"},"broil":{"en":"broil","de":"gratinieren"},"pan-fry":{"en":"pan-fry","de":"in der Pfanne braten"},"deep-fry":{"en":"deep-fry","de":"frittieren"},"stir-fry":{"en":"stir-fry","de":"wok-braten"},"poach":{"en":"poach","de":"pochieren"},"blanch":{"en":"blanch","de":"blanchieren"}}},"dimensions":{"diet":{"values":["classic","vegetarian","vegan","keto","halal","gluten-free","low-carb","pescatarian"],"labels":{"classic":{"en":"classic","de":"klassisch"},"vegetarian":{"en":"vegetarian","de":"vegetarisch"},"vegan":{"en":"vegan","de":"vegan"},"keto":{"en":"keto","de":"keto"},"halal":{"en":"halal","de":"halal"},"gluten-free":{"en":"gluten-free","de":"glutenfrei"},"low-carb":{"en":"low-carb","de":"kohlenhydratarm"},"pescatarian":{"en":"pescatarian","de":"pescetarisch"}}},"effort":{"values":["easy","medium","hard"],"labels":{"easy":{"en":"easy","de":"einfach"},"medium":{"en":"medium","de":"mittel"},"hard":{"en":"hard","de":"anspruchsvoll"}}},"calorie_level":{"values":["light","standard","hearty"],"labels":{"light":{"en":"light","de":"leicht"},"standard":{"en":"standard","de":"standard"},"hearty":{"en":"hearty","de":"deftig"}}}}}
